{
  "verdict": "verified",
  "matchesExpected": true,
  "existingTests": {
    "task": ":ticketing-domain:test",
    "passed": true,
    "failures": []
  },
  "before": {
    "file": "apps/boxoffice/ticketing-domain/src/main/java/net/terminalvalue/boxoffice/ticketing/domain/OrderLifecycle.java",
    "startLine": 51,
    "code": "            case PENDING_PAYMENT, CONFIRMED, DECLINED, REFUNDED -> unchanged(\"no refund outstanding\");\n        };\n        case CancellationRequested _ -> switch (current) {\n            case CONFIRMED -> transition(REFUND_PENDING, RELEASE_SEATS, REQUEST_REFUND);\n            case REFUND_PENDING, REFUNDED -> unchanged(\"already cancelled\");\n            case PENDING_PAYMENT -> new Decision.Rejected(\"payment is in progress; try again shortly\");\n            case DECLINED -> new Decision.Rejected(\"the order was never paid\");\n        };\n    };\n}\n\n"
  },
  "after": {
    "file": "apps/boxoffice/ticketing-domain/src/main/java/net/terminalvalue/boxoffice/ticketing/domain/OrderLifecycle.java",
    "startLine": 51,
    "code": "            case PENDING_PAYMENT, CONFIRMED, DECLINED, REFUNDED -> unchanged(\"no refund outstanding\");\n        };\n        case CancellationRequested _ -> switch (current) {\n            case CONFIRMED -> transition(REFUND_PENDING, RELEASE_SEATS, REQUEST_REFUND);\n            case REFUND_PENDING, REFUNDED -> unchanged(\"already cancelled\");\n            case PENDING_PAYMENT -> new Decision.Rejected(\"payment is in progress; try again in a few seconds\");\n            case DECLINED -> new Decision.Rejected(\"the order was never paid\");\n        };\n    };\n}\n\n"
  },
  "casesTotal": 36,
  "counterexamples": [],
  "purityViolations": [],
  "trustedCalls": [
    "java.lang.Enum.ordinal",
    "java.lang.MatchException.<init>",
    "java.lang.Record.<init>",
    "java.lang.runtime.SwitchBootstraps.typeSwitch",
    "java.util.List.copyOf",
    "java.util.List.of",
    "java.util.Objects.requireNonNull"
  ],
  "contractDiff": "--- a/apps/boxoffice/ticketing-domain/src/contract/OrderLifecycle.decide.contract\n+++ b/apps/boxoffice/ticketing-domain/src/contract/OrderLifecycle.decide.contract\n@@ -8,7 +8,7 @@\n decide(PENDING_PAYMENT, PaymentCaptured[seatsStillHeld=true])  => Transition[next=CONFIRMED, effects=[SELL_SEATS]]\n decide(PENDING_PAYMENT, PaymentDeclined[])                     => Transition[next=DECLINED, effects=[RELEASE_SEATS]]\n decide(PENDING_PAYMENT, PaymentRefunded[])                     => Unchanged[reason=\"no refund outstanding\"]\n-decide(PENDING_PAYMENT, CancellationRequested[])               => Rejected[reason=\"payment is in progress; try again shortly\"]\n+decide(PENDING_PAYMENT, CancellationRequested[])               => Rejected[reason=\"payment is in progress; try again in a few seconds\"]\n decide(PENDING_PAYMENT, null)                                  => throws NullPointerException\n decide(CONFIRMED, PaymentCaptured[seatsStillHeld=false])       => Unchanged[reason=\"payment already recorded\"]\n decide(CONFIRMED, PaymentCaptured[seatsStillHeld=true])        => Unchanged[reason=\"payment already recorded\"]\n",
  "sarif": "result.sarif",
  "output": "verifier-output.txt"
}
